{
  "id": "hulu",
  "verified": false,
  "note": "UNVERIFIED: never tried on the real site. Keys follow the common web-player shortcuts (space play/pause, arrows to skip 10 s, f fullscreen); selectors are guesses at its layout and are ignored when they match nothing.",
  "prefer": ["[data-testid='standard-tile'] a", "a[data-automationid*='tile']"],
  "close": ["button[aria-label='Close']"],
  "player": "#content-video-player",
  "back": ["field", "fullscreen", "overlay", "history"],
  "media": {"toggle": " ", "seek_back": "ArrowLeft", "seek_forward": "ArrowRight", "seek_step_s": 10, "fullscreen": "f"}
}
